{
  "$schema": "https://json-schema.org/draft/2020-12/schema",
  "$id": "https://github.com/shaug/agent-scripts/review-suite/evals/contracts/corpus.schema.json",
  "title": "Review replay corpus index",
  "description": "Version metadata and the case-identifier list. This index is deliberately outcome-free so it can sit beside the reviewer-visible artifacts.",
  "type": "object",
  "additionalProperties": false,
  "required": [
    "corpus_version",
    "protocol_version",
    "grader_version",
    "target_skill",
    "target_skill_dependencies",
    "cases"
  ],
  "properties": {
    "corpus_version": {"type": "string", "minLength": 1},
    "protocol_version": {"const": "1.0"},
    "grader_version": {"type": "string", "minLength": 1},
    "target_skill": {"type": "string", "minLength": 1},
    "target_skill_dependencies": {
      "description": "Sibling skills the target's own contract requires. Their text is shipped in every payload, because a target that must verify its dependencies cannot be evaluated without them. May be empty for a self-sufficient target.",
      "type": "array",
      "items": {"type": "string", "minLength": 1}
    },
    "cases": {
      "type": "array",
      "minItems": 1,
      "items": {"type": "string", "pattern": "^[a-z0-9]+(-[a-z0-9]+)*$"}
    }
  }
}
