{
  "corpus_version": "0.1-protocol-proof",
  "protocol_version": "1.0",
  "grader_version": "1.1",
  "target_skill": "review-code-change",
  "target_skill_dependencies": [
    "review-solution-simplicity",
    "review-correctness",
    "review-code-simplicity"
  ],
  "cases": [
    "ledger-charge-limit",
    "session-token-refresh",
    "invoice-export-batch",
    "webhook-retry-queue",
    "pricing-tier-lookup",
    "catalog-import-feed"
  ]
}
